id,method-name,parametes-method,return-method,field-access,methods-method,contain-class-name,attributes-class,methods-class,contain-class-context,target-class-name,attributes-class,methods-class,target-class-context,tag,move-tag
11,copy  Constant  Value,Tree  Expression,Tree  Node,type  type,const  Value  get  Kind  base  Type  int  Value  int  Value  set  Constant  Value,Expression,constant  Value,Expression  Expression  get  Type  Mirror  get  Constant  Value  set  Constant  Value  copy  needs  Parentheses  For  Macro  visit  visit  visit  visit,Expression  Object  Statement  Generator  Array  Initializer  Comma  Expression  Function  Invocation  String  Literal,Tree  Converter,unit  env  new  Unit  trees  source  Positions  Stack  State  expression  next  Child,convert  Compilation  Unit  Tree  Converter  convert  get  Position  convert  Inner  convert  Annotation  convert  Annotations  convert  Annotation  Type  Declaration  convert  Array  Access  convert  Array  Type  convert  Assert  convert  Assignment  convert  Assign  Op  convert  Binary  convert  Block  convert  Body  Declaration  convert  Boolean  Literal  convert  Break  Statement  convert  Case  convert  Catch  convert  Char  Literal  convert  Class  Declaration  convert  Class  Declaration  Helper  convert  Conditional  Expression  convert  Continue  Statement  convert  Do  Statement  convert  Enhanced  For  Statement  convert  Enum  convert  Expression  Statement  convert  Field  Access  convert  For  Loop  convert  Functional  Expression  get  Targets  convert  Ident  convert  If  convert  Instance  Of  convert  Labeled  Statement  convert  Lambda  convert  Method  Reference  convert  Member  Reference  convert  Method  Declaration  get  Member  Name  convert  Method  Invocation  convert  New  Array  convert  New  Class  convert  Number  Literal  convert  Package  convert  Prefix  Expr  convert  Parens  convert  Post  Expr  convert  Primitive  Type  convert  Return  convert  String  Literal  convert  Switch  convert  Synchronized  convert  Throw  convert  Try  convert  Type  convert  Type  convert  Type  Apply  convert  Type  Cast  convert  Variable  Declaration  convert  Single  Variable  convert  Variable  Expression  convert  While  Loop  get  Associated  Java  Doc  convert  Associated  Comment  convert  Javadoc  Comment  add  Ocni  Comments  add  Native  Comments  get  Path  get  Tree  Source  convert  Without  Parens  get  Source  Position  get  Name  Position  get  Element  get  Type  Mirror  get  Tree  Path  Stack  State  next  Child,Options  Javac  Environment  Compilation  Unit  Tree  Compilation  Unit  Tree  Javac  Environment  Tree  Tree  Path  Tree  Tree  Tree  Path  Annotation  Tree  Tree  Path  Modifiers  Tree  Tree  Path  Class  Tree  Tree  Path  Array  Access  Tree  Tree  Path  Array  Type  Tree  Tree  Path  Assert  Tree  Tree  Path  Assignment  Tree  Tree  Path  Compound  Assignment  Tree  Tree  Path  Binary  Tree  Tree  Path  Block  Tree  Tree  Path  Tree  Tree  Path  Modifiers  Tree  Body  Declaration  Literal  Tree  Tree  Path  Break  Tree  Case  Tree  Tree  Path  Catch  Tree  Tree  Path  Literal  Tree  Tree  Path  Class  Tree  Tree  Path  Class  Tree  Tree  Path  Conditional  Expression  Tree  Tree  Path  Continue  Tree  Do  While  Loop  Tree  Tree  Path  Enhanced  For  Loop  Tree  Tree  Path  Class  Tree  Tree  Path  Tree  Expression  Expression  Statement  Tree  Tree  Path  Member  Select  Tree  Tree  Path  For  Loop  Tree  Tree  Path  J  C  Functional  Expression  Tree  Path  Functional  Expression  extends  J  C  Functional  Expression  Tree  Path  Identifier  Tree  Tree  Path  If  Tree  Tree  Path  Instance  Of  Tree  Tree  Path  Labeled  Statement  Tree  Tree  Path  Lambda  Expression  Tree  Tree  Path  Member  Reference  Tree  Tree  Path  Method  Reference  Member  Reference  Tree  Tree  Path  Method  Tree  Tree  Path  Expression  Tree  Method  Invocation  Tree  Tree  Path  New  Array  Tree  Tree  Path  New  Class  Tree  Tree  Path  Literal  Tree  Tree  Path  Tree  Path  Unary  Tree  Tree  Path  Parenthesized  Tree  Tree  Path  Unary  Tree  Tree  Path  Primitive  Type  Tree  Tree  Path  Return  Tree  Tree  Path  Literal  Tree  Tree  Path  Switch  Tree  Tree  Path  Synchronized  Tree  Tree  Path  Throw  Tree  Tree  Path  Try  Tree  Tree  Path  Type  Mirror  Type  Mirror  Source  Position  boolean  Parameterized  Type  Tree  Tree  Path  Type  Cast  Tree  Tree  Path  Variable  Tree  Tree  Path  Variable  Tree  Tree  Path  Variable  Tree  Tree  Path  While  Loop  Tree  Tree  Path  Tree  Tree  Path  Tree  Tree  Path  Tree  Path  Compilation  Unit  boolean  Compilation  Unit  String  String  Java  File  Object  Tree  Expression  Tree  Tree  Path  int  int  Tree  Tree  Path  Tree  Path  Tree  Path  Tree  Binary  Tree,1,0
12,convert  Simple  Name,Element  Type  Mirror  Tree  Converter,Simple  Name,,set  Position,Tree  Converter,unit  env  new  Unit  trees  source  Positions  Stack  State  expression  next  Child,convert  Compilation  Unit  Tree  Converter  convert  get  Position  convert  Inner  convert  Annotation  convert  Annotations  convert  Annotation  Type  Declaration  convert  Array  Access  convert  Array  Type  convert  Assert  convert  Assignment  convert  Assign  Op  convert  Binary  convert  Block  convert  Body  Declaration  convert  Boolean  Literal  convert  Break  Statement  convert  Case  convert  Catch  convert  Char  Literal  convert  Class  Declaration  convert  Class  Declaration  Helper  convert  Conditional  Expression  convert  Continue  Statement  convert  Do  Statement  convert  Enhanced  For  Statement  convert  Enum  copy  Constant  Value  convert  Expression  Statement  convert  Field  Access  convert  For  Loop  convert  Functional  Expression  get  Targets  convert  Ident  convert  If  convert  Instance  Of  convert  Labeled  Statement  convert  Lambda  convert  Method  Reference  convert  Member  Reference  convert  Method  Declaration  get  Member  Name  convert  Method  Invocation  convert  New  Array  convert  New  Class  convert  Number  Literal  convert  Package  convert  Prefix  Expr  convert  Parens  convert  Post  Expr  convert  Primitive  Type  convert  Return  convert  String  Literal  convert  Switch  convert  Synchronized  convert  Throw  convert  Try  convert  Type  convert  Type  convert  Type  Apply  convert  Type  Cast  convert  Variable  Declaration  convert  Single  Variable  convert  Variable  Expression  convert  While  Loop  get  Associated  Java  Doc  convert  Associated  Comment  convert  Javadoc  Comment  add  Ocni  Comments  add  Native  Comments  get  Path  get  Tree  Source  convert  Without  Parens  get  Source  Position  get  Name  Position  get  Element  get  Type  Mirror  get  Tree  Path  Stack  State  next  Child,Options  Javac  Environment  Compilation  Unit  Tree  Compilation  Unit  Tree  Javac  Environment  Tree  Tree  Path  Tree  Tree  Tree  Path  Annotation  Tree  Tree  Path  Modifiers  Tree  Tree  Path  Class  Tree  Tree  Path  Array  Access  Tree  Tree  Path  Array  Type  Tree  Tree  Path  Assert  Tree  Tree  Path  Assignment  Tree  Tree  Path  Compound  Assignment  Tree  Tree  Path  Binary  Tree  Tree  Path  Block  Tree  Tree  Path  Tree  Tree  Path  Modifiers  Tree  Body  Declaration  Literal  Tree  Tree  Path  Break  Tree  Case  Tree  Tree  Path  Catch  Tree  Tree  Path  Literal  Tree  Tree  Path  Class  Tree  Tree  Path  Class  Tree  Tree  Path  Conditional  Expression  Tree  Tree  Path  Continue  Tree  Do  While  Loop  Tree  Tree  Path  Enhanced  For  Loop  Tree  Tree  Path  Class  Tree  Tree  Path  Tree  Expression  Expression  Statement  Tree  Tree  Path  Member  Select  Tree  Tree  Path  For  Loop  Tree  Tree  Path  J  C  Functional  Expression  Tree  Path  Functional  Expression  extends  J  C  Functional  Expression  Tree  Path  Identifier  Tree  Tree  Path  If  Tree  Tree  Path  Instance  Of  Tree  Tree  Path  Labeled  Statement  Tree  Tree  Path  Lambda  Expression  Tree  Tree  Path  Member  Reference  Tree  Tree  Path  Method  Reference  Member  Reference  Tree  Tree  Path  Method  Tree  Tree  Path  Expression  Tree  Method  Invocation  Tree  Tree  Path  New  Array  Tree  Tree  Path  New  Class  Tree  Tree  Path  Literal  Tree  Tree  Path  Tree  Path  Unary  Tree  Tree  Path  Parenthesized  Tree  Tree  Path  Unary  Tree  Tree  Path  Primitive  Type  Tree  Tree  Path  Return  Tree  Tree  Path  Literal  Tree  Tree  Path  Switch  Tree  Tree  Path  Synchronized  Tree  Tree  Path  Throw  Tree  Tree  Path  Try  Tree  Tree  Path  Type  Mirror  Type  Mirror  Source  Position  boolean  Parameterized  Type  Tree  Tree  Path  Type  Cast  Tree  Tree  Path  Variable  Tree  Tree  Path  Variable  Tree  Tree  Path  Variable  Tree  Tree  Path  While  Loop  Tree  Tree  Path  Tree  Tree  Path  Tree  Tree  Path  Tree  Path  Compilation  Unit  boolean  Compilation  Unit  String  String  Java  File  Object  Tree  Expression  Tree  Tree  Path  int  int  Tree  Tree  Path  Tree  Path  Tree  Path  Tree  Binary  Tree,Source  Position,start  Position  length  line  Number  no  position,Source  Position  Source  Position  get  Start  Position  get  Length  set  Source  Range  get  Line  Number  set  Line  Number,int  int  int  int  int  int  int  int  Element  Type  Mirror  Tree  Converter,0,0
13,convert  Simple  Name,Element  Type  Mirror  Tree  Converter,Simple  Name,,set  Position,Source  Position,start  Position  length  line  Number  no  position,Source  Position  Source  Position  get  Start  Position  get  Length  set  Source  Range  get  Line  Number  set  Line  Number,int  int  int  int  int  int  int  int  Element  Type  Mirror  Tree  Converter,Tree  Converter,unit  env  new  Unit  trees  source  Positions  Stack  State  expression  next  Child,convert  Compilation  Unit  Tree  Converter  convert  get  Position  convert  Inner  convert  Annotation  convert  Annotations  convert  Annotation  Type  Declaration  convert  Array  Access  convert  Array  Type  convert  Assert  convert  Assignment  convert  Assign  Op  convert  Binary  convert  Block  convert  Body  Declaration  convert  Boolean  Literal  convert  Break  Statement  convert  Case  convert  Catch  convert  Char  Literal  convert  Class  Declaration  convert  Class  Declaration  Helper  convert  Conditional  Expression  convert  Continue  Statement  convert  Do  Statement  convert  Enhanced  For  Statement  convert  Enum  copy  Constant  Value  convert  Expression  Statement  convert  Field  Access  convert  For  Loop  convert  Functional  Expression  get  Targets  convert  Ident  convert  If  convert  Instance  Of  convert  Labeled  Statement  convert  Lambda  convert  Method  Reference  convert  Member  Reference  convert  Method  Declaration  get  Member  Name  convert  Method  Invocation  convert  New  Array  convert  New  Class  convert  Number  Literal  convert  Package  convert  Prefix  Expr  convert  Parens  convert  Post  Expr  convert  Primitive  Type  convert  Return  convert  String  Literal  convert  Switch  convert  Synchronized  convert  Throw  convert  Try  convert  Type  convert  Type  convert  Type  Apply  convert  Type  Cast  convert  Variable  Declaration  convert  Single  Variable  convert  Variable  Expression  convert  While  Loop  get  Associated  Java  Doc  convert  Associated  Comment  convert  Javadoc  Comment  add  Ocni  Comments  add  Native  Comments  get  Path  get  Tree  Source  convert  Without  Parens  get  Source  Position  get  Name  Position  get  Element  get  Type  Mirror  get  Tree  Path  Stack  State  next  Child,Options  Javac  Environment  Compilation  Unit  Tree  Compilation  Unit  Tree  Javac  Environment  Tree  Tree  Path  Tree  Tree  Tree  Path  Annotation  Tree  Tree  Path  Modifiers  Tree  Tree  Path  Class  Tree  Tree  Path  Array  Access  Tree  Tree  Path  Array  Type  Tree  Tree  Path  Assert  Tree  Tree  Path  Assignment  Tree  Tree  Path  Compound  Assignment  Tree  Tree  Path  Binary  Tree  Tree  Path  Block  Tree  Tree  Path  Tree  Tree  Path  Modifiers  Tree  Body  Declaration  Literal  Tree  Tree  Path  Break  Tree  Case  Tree  Tree  Path  Catch  Tree  Tree  Path  Literal  Tree  Tree  Path  Class  Tree  Tree  Path  Class  Tree  Tree  Path  Conditional  Expression  Tree  Tree  Path  Continue  Tree  Do  While  Loop  Tree  Tree  Path  Enhanced  For  Loop  Tree  Tree  Path  Class  Tree  Tree  Path  Tree  Expression  Expression  Statement  Tree  Tree  Path  Member  Select  Tree  Tree  Path  For  Loop  Tree  Tree  Path  J  C  Functional  Expression  Tree  Path  Functional  Expression  extends  J  C  Functional  Expression  Tree  Path  Identifier  Tree  Tree  Path  If  Tree  Tree  Path  Instance  Of  Tree  Tree  Path  Labeled  Statement  Tree  Tree  Path  Lambda  Expression  Tree  Tree  Path  Member  Reference  Tree  Tree  Path  Method  Reference  Member  Reference  Tree  Tree  Path  Method  Tree  Tree  Path  Expression  Tree  Method  Invocation  Tree  Tree  Path  New  Array  Tree  Tree  Path  New  Class  Tree  Tree  Path  Literal  Tree  Tree  Path  Tree  Path  Unary  Tree  Tree  Path  Parenthesized  Tree  Tree  Path  Unary  Tree  Tree  Path  Primitive  Type  Tree  Tree  Path  Return  Tree  Tree  Path  Literal  Tree  Tree  Path  Switch  Tree  Tree  Path  Synchronized  Tree  Tree  Path  Throw  Tree  Tree  Path  Try  Tree  Tree  Path  Type  Mirror  Type  Mirror  Source  Position  boolean  Parameterized  Type  Tree  Tree  Path  Type  Cast  Tree  Tree  Path  Variable  Tree  Tree  Path  Variable  Tree  Tree  Path  Variable  Tree  Tree  Path  While  Loop  Tree  Tree  Path  Tree  Tree  Path  Tree  Tree  Path  Tree  Path  Compilation  Unit  boolean  Compilation  Unit  String  String  Java  File  Object  Tree  Expression  Tree  Tree  Path  int  int  Tree  Tree  Path  Tree  Path  Tree  Path  Tree  Binary  Tree,1,1
14,remove  Interface  Modifiers,Class  File  Converter,void,,remove  Modifiers  get  Body  Declarations  remove  Modifiers,Class  File  Converter,parser  Env  translation  Env  file  class  File  type  Name,convert  Class  File  Class  File  Converter  set  Class  Path  create  Unit  convert  Class  Initializer  convert  convert  Name  convert  Package  convert  Body  Declaration  convert  Annotation  Type  Member  Declaration  convert  Annotation  Type  Declaration  convert  Annotation  Value  convert  Annotation  convert  Annotations  convert  Type  Declaration  get  Method  Descriptor  convert  Method  Declaration  convert  Parameter  convert  Field  Declaration  is  Enum  Synthetic  convert  Enum  Declaration  convert  Enum  Constant  Declaration,Options  Javac  Environment  Input  File  Javac  Environment  Translation  Environment  Input  File  Abstract  Type  Declaration  Element  Tree  Node  Element  Package  Element  Body  Declaration  Element  Executable  Element  Type  Element  Type  Mirror  Annotation  Value  Annotation  Mirror  Element  Type  Element  Executable  Element  Executable  Element  Abstract  Type  Declaration  Variable  Element  Variable  Element  Element  Type  Mirror  Type  Element  Variable  Element,Abstract  Type  Declaration,type  Element  name  body  Declarations  class  Init  Statements  is  Dead  Class,Abstract  Type  Declaration  Abstract  Type  Declaration  Abstract  Type  Declaration  get  Type  Element  set  Type  Element  get  Name  set  Name  get  Body  Declarations  get  Class  Init  Statements  set  Class  Init  Statements  validate  Inner  add  Body  Declaration  add  Body  Declaration  add  Class  Init  Statement  add  Class  Init  Statement  is  Dead  Class  set  Dead  Class,Abstract  Type  Declaration  Type  Element  Type  Element  Simple  Name  List  Statement  Body  Declaration  int  Body  Declaration  Statement  int  Statement  boolean  Class  File  Converter,0,0
15,remove  Interface  Modifiers,Class  File  Converter,void,,remove  Modifiers  get  Body  Declarations  remove  Modifiers,Abstract  Type  Declaration,type  Element  name  body  Declarations  class  Init  Statements  is  Dead  Class,Abstract  Type  Declaration  Abstract  Type  Declaration  Abstract  Type  Declaration  get  Type  Element  set  Type  Element  get  Name  set  Name  get  Body  Declarations  get  Class  Init  Statements  set  Class  Init  Statements  validate  Inner  add  Body  Declaration  add  Body  Declaration  add  Class  Init  Statement  add  Class  Init  Statement  is  Dead  Class  set  Dead  Class,Abstract  Type  Declaration  Type  Element  Type  Element  Simple  Name  List  Statement  Body  Declaration  int  Body  Declaration  Statement  int  Statement  boolean  Class  File  Converter,Class  File  Converter,parser  Env  translation  Env  file  class  File  type  Name,convert  Class  File  Class  File  Converter  set  Class  Path  create  Unit  convert  Class  Initializer  convert  convert  Name  convert  Package  convert  Body  Declaration  convert  Annotation  Type  Member  Declaration  convert  Annotation  Type  Declaration  convert  Annotation  Value  convert  Annotation  convert  Annotations  convert  Type  Declaration  get  Method  Descriptor  convert  Method  Declaration  convert  Parameter  convert  Field  Declaration  is  Enum  Synthetic  convert  Enum  Declaration  convert  Enum  Constant  Declaration,Options  Javac  Environment  Input  File  Javac  Environment  Translation  Environment  Input  File  Abstract  Type  Declaration  Element  Tree  Node  Element  Package  Element  Body  Declaration  Element  Executable  Element  Type  Element  Type  Mirror  Annotation  Value  Annotation  Mirror  Element  Type  Element  Executable  Element  Executable  Element  Abstract  Type  Declaration  Variable  Element  Variable  Element  Element  Type  Mirror  Type  Element  Variable  Element,1,1
16,add  Cast,Expression,void,,get  Type  Mirror  replace  With  parenthesize  set  Expression,Cast  Resolver,narrowing  Map,Cast  Resolver  end  Visit  rewrite  Float  To  Integral  Cast  is  Object  Array  create  Cast  Check  maybe  Add  Cast  needs  Cast  get  Declared  Type  get  Declared  Return  Type  return  Value  Needs  Int  Cast  maybe  Cast  Arguments  maybe  Cast  Arguments  end  Visit  end  Visit  end  Visit  end  Visit  end  Visit  end  Visit  end  Visit  end  Visit  end  Visit  end  Visit  end  Visit  end  Visit  end  Visit  end  Visit  incompatible  Types  visit  end  Visit  get  Instanceof  Var  needs  Cast  Chk,Compilation  Unit  Cast  Expression  Type  Mirror  Expression  String  Type  Mirror  Type  Mirror  Type  Mirror  Expression  Expression  Expression  Type  Mirror  boolean  Expression  Type  Mirror  boolean  Expression  Executable  Element  Type  Mirror  Expression  List  Expression  Type  Mirror  List  Expression  Executable  Element  Class  Instance  Creation  Constructor  Invocation  Enum  Constant  Declaration  Field  Access  Function  Invocation  Method  Invocation  Return  Statement  Super  Constructor  Invocation  Super  Method  Invocation  Assignment  Variable  Declaration  Fragment  Method  Declaration  Infix  Expression  Conditional  Expression  Expression  Expression  If  Statement  If  Statement  Expression  Expression  Type  Mirror,Expression,constant  Value,Expression  Expression  get  Type  Mirror  get  Constant  Value  set  Constant  Value  copy  needs  Parentheses  For  Macro  visit  visit  visit  visit,Expression  Object  Statement  Generator  Array  Initializer  Comma  Expression  Function  Invocation  String  Literal,0,0
17,add  Cast,Expression,void,,get  Type  Mirror  replace  With  parenthesize  set  Expression,Expression,constant  Value,Expression  Expression  get  Type  Mirror  get  Constant  Value  set  Constant  Value  copy  needs  Parentheses  For  Macro  visit  visit  visit  visit,Expression  Object  Statement  Generator  Array  Initializer  Comma  Expression  Function  Invocation  String  Literal,Cast  Resolver,narrowing  Map,Cast  Resolver  end  Visit  rewrite  Float  To  Integral  Cast  is  Object  Array  create  Cast  Check  maybe  Add  Cast  needs  Cast  get  Declared  Type  get  Declared  Return  Type  return  Value  Needs  Int  Cast  maybe  Cast  Arguments  maybe  Cast  Arguments  end  Visit  end  Visit  end  Visit  end  Visit  end  Visit  end  Visit  end  Visit  end  Visit  end  Visit  end  Visit  end  Visit  end  Visit  end  Visit  end  Visit  incompatible  Types  visit  end  Visit  get  Instanceof  Var  needs  Cast  Chk,Compilation  Unit  Cast  Expression  Type  Mirror  Expression  String  Type  Mirror  Type  Mirror  Type  Mirror  Expression  Expression  Expression  Type  Mirror  boolean  Expression  Type  Mirror  boolean  Expression  Executable  Element  Type  Mirror  Expression  List  Expression  Type  Mirror  List  Expression  Executable  Element  Class  Instance  Creation  Constructor  Invocation  Enum  Constant  Declaration  Field  Access  Function  Invocation  Method  Invocation  Return  Statement  Super  Constructor  Invocation  Super  Method  Invocation  Assignment  Variable  Declaration  Fragment  Method  Declaration  Infix  Expression  Conditional  Expression  Expression  Expression  If  Statement  If  Statement  Expression  Expression  Type  Mirror,1,0
18,get  Instanceof  Var,Expression,Variable  Element,,get  Kind  get  Variable  Element  get  Left  Operand,Cast  Resolver,narrowing  Map,Cast  Resolver  end  Visit  rewrite  Float  To  Integral  Cast  is  Object  Array  create  Cast  Check  add  Cast  maybe  Add  Cast  needs  Cast  get  Declared  Type  get  Declared  Return  Type  return  Value  Needs  Int  Cast  maybe  Cast  Arguments  maybe  Cast  Arguments  end  Visit  end  Visit  end  Visit  end  Visit  end  Visit  end  Visit  end  Visit  end  Visit  end  Visit  end  Visit  end  Visit  end  Visit  end  Visit  end  Visit  incompatible  Types  visit  end  Visit  needs  Cast  Chk,Compilation  Unit  Cast  Expression  Type  Mirror  Expression  String  Type  Mirror  Type  Mirror  Type  Mirror  Expression  Expression  Expression  Type  Mirror  boolean  Expression  Type  Mirror  boolean  Expression  Executable  Element  Type  Mirror  Expression  List  Expression  Type  Mirror  List  Expression  Executable  Element  Class  Instance  Creation  Constructor  Invocation  Enum  Constant  Declaration  Field  Access  Function  Invocation  Method  Invocation  Return  Statement  Super  Constructor  Invocation  Super  Method  Invocation  Assignment  Variable  Declaration  Fragment  Method  Declaration  Infix  Expression  Conditional  Expression  Expression  Expression  If  Statement  If  Statement  Expression  Expression  Type  Mirror,Expression,constant  Value,Expression  Expression  get  Type  Mirror  get  Constant  Value  set  Constant  Value  copy  needs  Parentheses  For  Macro  visit  visit  visit  visit,Expression  Object  Statement  Generator  Array  Initializer  Comma  Expression  Function  Invocation  String  Literal,0,0
19,get  Instanceof  Var,Expression,Variable  Element,,get  Kind  get  Variable  Element  get  Left  Operand,Expression,constant  Value,Expression  Expression  get  Type  Mirror  get  Constant  Value  set  Constant  Value  copy  needs  Parentheses  For  Macro  visit  visit  visit  visit,Expression  Object  Statement  Generator  Array  Initializer  Comma  Expression  Function  Invocation  String  Literal,Cast  Resolver,narrowing  Map,Cast  Resolver  end  Visit  rewrite  Float  To  Integral  Cast  is  Object  Array  create  Cast  Check  add  Cast  maybe  Add  Cast  needs  Cast  get  Declared  Type  get  Declared  Return  Type  return  Value  Needs  Int  Cast  maybe  Cast  Arguments  maybe  Cast  Arguments  end  Visit  end  Visit  end  Visit  end  Visit  end  Visit  end  Visit  end  Visit  end  Visit  end  Visit  end  Visit  end  Visit  end  Visit  end  Visit  end  Visit  incompatible  Types  visit  end  Visit  needs  Cast  Chk,Compilation  Unit  Cast  Expression  Type  Mirror  Expression  String  Type  Mirror  Type  Mirror  Type  Mirror  Expression  Expression  Expression  Type  Mirror  boolean  Expression  Type  Mirror  boolean  Expression  Executable  Element  Type  Mirror  Expression  List  Expression  Type  Mirror  List  Expression  Executable  Element  Class  Instance  Creation  Constructor  Invocation  Enum  Constant  Declaration  Field  Access  Function  Invocation  Method  Invocation  Return  Statement  Super  Constructor  Invocation  Super  Method  Invocation  Assignment  Variable  Declaration  Fragment  Method  Declaration  Infix  Expression  Conditional  Expression  Expression  Expression  If  Statement  If  Statement  Expression  Expression  Type  Mirror,1,0
20,is  Simple  Enum,Enum  Rewriter,boolean,,get  Type  Element  get  Enum  Constants  get  Executable  Element  size  get  Parameters  is  Var  Args  has  Annotation  get  Declaring  Class,Enum  Rewriter,,Enum  Rewriter  end  Visit  add  Enum  Initialization  add  Simple  Non  Arc  Initialization  add  Non  Arc  Initialization  add  Arc  Initialization  visit  add  Values  Method  add  Value  Of  Method  add  Extra  Native  Decls,Compilation  Unit  Enum  Declaration  Enum  Declaration  Enum  Declaration  Enum  Declaration  Enum  Declaration  Method  Declaration  Enum  Declaration  Enum  Declaration  Enum  Declaration,Enum  Declaration,strip  Super  Interfaces  enum  Constants,Enum  Declaration  Enum  Declaration  Enum  Declaration  get  Kind  get  Super  Interface  Type  Mirrors  strip  Super  Interfaces  get  Enum  Constants  add  Enum  Constant  accept  Inner  copy,Enum  Declaration  Type  Element  extends  Enum  Constant  Declaration  Tree  Visitor  Enum  Rewriter,0,0
