id,method-name,parametes-method,return-method,field-access,methods-method,contain-class-name,attributes-class,methods-class,contain-class-context,target-class-name,attributes-class,methods-class,target-class-context,tag,move-tag
0,get  Source  Indent,Javadoc  Generator,String,,get  Start  Position  get  Parent  get  Kind  get  Parent  get  Source  char  At  is  Whitespace  substring  index  Of  length  substring  substring,Javadoc  Generator,spanning  Pre  Tag  spanning  Style  Tag  html  Entities,Javadoc  Generator  print  Doc  Comment  to  String  to  String  print  Doc  Comment  print  Doc  Line  print  Tag  format  Link  Tag  has  Type  Param  print  Tag  Fragments  escape  Code  Text  escape  Doc  Text  escape  Html  Text  skip  Style  Tag,Source  Builder  Source  Builder  Javadoc  Javadoc  Tag  Element  Javadoc  String  Tag  Element  Tag  Element  String  List  Tree  Node  List  Tree  Node  String  String  String  String,Tree  Node,owner  start  Position  length  line  Number  Kind,Tree  Node  Tree  Node  get  Kind  get  Parent  set  Owner  remove  replace  With  get  Start  Position  get  Length  set  Source  Range  get  Line  Number  set  Line  Number  accept  accept  Inner  copy  validate  pre  Visit  validate  Inner  set  Position  to  String,Tree  Node  Tree  Node  Tree  Node  int  int  int  Tree  Visitor  Tree  Visitor  Tree  Node  Source  Position  Javadoc  Generator,0,0
1,get  Source  Indent,Javadoc  Generator,String,,get  Start  Position  get  Parent  get  Kind  get  Parent  get  Source  char  At  is  Whitespace  substring  index  Of  length  substring  substring,Tree  Node,owner  start  Position  length  line  Number  Kind,Tree  Node  Tree  Node  get  Kind  get  Parent  set  Owner  remove  replace  With  get  Start  Position  get  Length  set  Source  Range  get  Line  Number  set  Line  Number  accept  accept  Inner  copy  validate  pre  Visit  validate  Inner  set  Position  to  String,Tree  Node  Tree  Node  Tree  Node  int  int  int  Tree  Visitor  Tree  Visitor  Tree  Node  Source  Position  Javadoc  Generator,Javadoc  Generator,spanning  Pre  Tag  spanning  Style  Tag  html  Entities,Javadoc  Generator  print  Doc  Comment  to  String  to  String  print  Doc  Comment  print  Doc  Line  print  Tag  format  Link  Tag  has  Type  Param  print  Tag  Fragments  escape  Code  Text  escape  Doc  Text  escape  Html  Text  skip  Style  Tag,Source  Builder  Source  Builder  Javadoc  Javadoc  Tag  Element  Javadoc  String  Tag  Element  Tag  Element  String  List  Tree  Node  List  Tree  Node  String  String  String  String,1,1
2,needs  Parentheses  For  Macro,Statement  Generator,boolean,,accept,Statement  Generator,buffer,generate  Statement  Generator  get  Result  print  Method  Invocation  Name  And  Args  pre  Visit  visit  visit  visit  visit  visit  visit  visit  print  Statements  visit  visit  visit  visit  visit  visit  visit  visit  visit  visit  visit  visit  visit  visit  visit  visit  visit  visit  visit  visit  visit  visit  visit  visit  visit  visit  visit  visit  visit  visit  visit  visit  visit  visit  visit  visit  visit  visit  visit  visit  visit  visit  visit  visit  visit  visit  visit  visit  visit  visit  visit  visit  visit  visit  print  Multi  Catch  visit  visit  visit  visit  visit  visit  visit  accept  Macro  Argument,Tree  Node  int  Tree  Node  int  String  List  Expression  Tree  Node  Array  Access  Array  Creation  Array  Initializer  Array  Type  Assert  Statement  Assignment  Block  List  Boolean  Literal  Break  Statement  C  String  Literal  Cast  Expression  Character  Literal  Class  Instance  Creation  Comma  Expression  Conditional  Expression  Constructor  Invocation  Continue  Statement  Creation  Reference  Do  Statement  Empty  Statement  Enhanced  For  Statement  Expression  Method  Reference  Expression  Statement  Field  Access  For  Statement  Function  Invocation  If  Statement  Infix  Expression  Instanceof  Expression  Intersection  Type  Labeled  Statement  Lambda  Expression  Marker  Annotation  Method  Invocation  Native  Expression  Native  Statement  Normal  Annotation  Null  Literal  Number  Literal  Parenthesized  Expression  Postfix  Expression  Prefix  Expression  Primitive  Type  Qualified  Name  Qualified  Type  Return  Statement  Simple  Name  Simple  Type  Single  Member  Annotation  Single  Variable  Declaration  String  Literal  Super  Constructor  Invocation  Super  Field  Access  Super  Method  Invocation  Super  Method  Reference  Switch  Case  Switch  Statement  Synchronized  Statement  This  Expression  Throw  Statement  Try  Statement  Catch  Clause  Type  Literal  Type  Method  Reference  Variable  Declaration  Expression  Variable  Declaration  Fragment  Variable  Declaration  Statement  While  Statement  Initializer  Expression,Expression,constant  Value,Expression  Expression  get  Type  Mirror  get  Constant  Value  set  Constant  Value  copy  visit  visit  visit  visit,Expression  Object  Statement  Generator  Array  Initializer  Comma  Expression  Function  Invocation  String  Literal,0,0
3,needs  Parentheses  For  Macro,Statement  Generator,boolean,,accept,Expression,constant  Value,Expression  Expression  get  Type  Mirror  get  Constant  Value  set  Constant  Value  copy  visit  visit  visit  visit,Expression  Object  Statement  Generator  Array  Initializer  Comma  Expression  Function  Invocation  String  Literal,Statement  Generator,buffer,generate  Statement  Generator  get  Result  print  Method  Invocation  Name  And  Args  pre  Visit  visit  visit  visit  visit  visit  visit  visit  print  Statements  visit  visit  visit  visit  visit  visit  visit  visit  visit  visit  visit  visit  visit  visit  visit  visit  visit  visit  visit  visit  visit  visit  visit  visit  visit  visit  visit  visit  visit  visit  visit  visit  visit  visit  visit  visit  visit  visit  visit  visit  visit  visit  visit  visit  visit  visit  visit  visit  visit  visit  visit  visit  visit  visit  print  Multi  Catch  visit  visit  visit  visit  visit  visit  visit  accept  Macro  Argument,Tree  Node  int  Tree  Node  int  String  List  Expression  Tree  Node  Array  Access  Array  Creation  Array  Initializer  Array  Type  Assert  Statement  Assignment  Block  List  Boolean  Literal  Break  Statement  C  String  Literal  Cast  Expression  Character  Literal  Class  Instance  Creation  Comma  Expression  Conditional  Expression  Constructor  Invocation  Continue  Statement  Creation  Reference  Do  Statement  Empty  Statement  Enhanced  For  Statement  Expression  Method  Reference  Expression  Statement  Field  Access  For  Statement  Function  Invocation  If  Statement  Infix  Expression  Instanceof  Expression  Intersection  Type  Labeled  Statement  Lambda  Expression  Marker  Annotation  Method  Invocation  Native  Expression  Native  Statement  Normal  Annotation  Null  Literal  Number  Literal  Parenthesized  Expression  Postfix  Expression  Prefix  Expression  Primitive  Type  Qualified  Name  Qualified  Type  Return  Statement  Simple  Name  Simple  Type  Single  Member  Annotation  Single  Variable  Declaration  String  Literal  Super  Constructor  Invocation  Super  Field  Access  Super  Method  Invocation  Super  Method  Reference  Switch  Case  Switch  Statement  Synchronized  Statement  This  Expression  Throw  Statement  Try  Statement  Catch  Clause  Type  Literal  Type  Method  Reference  Variable  Declaration  Expression  Variable  Declaration  Fragment  Variable  Declaration  Statement  While  Statement  Initializer  Expression,1,1
4,are  Parameters  Nonnull  By  Default,Element  Element  Util,boolean,,has  Annotation  get  Package  has  Annotation  to  String  get  Qualified  Name  has  Parameters  Are  Nonnull  By  Default  get  Package  Info  Lookup,Element  Util,acc  bridge  acc  varargs  acc  synthetic  acc  annotation  acc  enum  acc  anonymous  acc  flag  mask  visibility  modifiers  lazy  init  nullable  pattern  nonnull  pattern  javac  Elements  element  Type  Map,Element  Util  get  Name  get  Qualified  Name  is  Named  is  Static  is  Default  is  Final  is  Public  is  Private  is  Volatile  is  Top  Level  is  Anonymous  is  Local  is  Lambda  is  Interface  is  Annotation  Type  is  Enum  is  Enum  Constant  is  Package  is  Type  Element  is  Executable  Element  is  Type  Parameter  Element  is  Annotation  Member  get  Declaring  Class  get  Superclass  get  Interfaces  is  Primitive  Constant  is  Constant  is  String  Constant  is  Global  Var  is  Instance  Var  is  Nonnull  get  Type  Qualifiers  is  Abstract  is  Native  is  Synchronized  is  Synthetic  is  Synthetic  get  Header  is  Ios  Type  get  Selector  is  Package  Info  is  Private  Inner  Type  has  Outer  Context  has  Modifier  is  Variable  is  Field  is  Parameter  is  Local  Variable  is  Method  is  Constructor  is  Instance  Method  is  Weak  Reference  is  Weak  Outer  Type  has  Weak  Property  Attribute  parse  Property  Attribute  is  Retained  With  Field  filter  Enclosed  Elements  get  Methods  get  Constructors  get  Executables  get  Declared  Fields  get  Declared  Types  params  Match  find  Method  find  Getter  Method  find  Setter  Method  find  Constructor  find  Field  as  Types  overrides  get  Package  get  Package  Name  get  Parent  Package  get  Binary  Name  get  Element  Values  With  Defaults  get  Visibility  Modifiers  from  Modifier  Set  is  Runtime  Annotation  is  Runtime  Annotation  is  Generated  Annotation  is  Generated  Annotation  has  Retention  Policy  get  Annotation  has  Annotation  has  Named  Annotation  has  Named  Annotation  has  Qualified  Named  Annotation  get  Qualified  Named  Annotation  get  All  Annotations  has  Nullable  Annotation  has  Nonnull  Annotation  has  Nullability  Annotation  get  Annotation  Value  get  Sorted  Annotation  Members  suppresses  Warning  map  Element  Type  get  Type  is  Nonnull  get  Source  File,Elements  Element  Type  Element  Element  String  Element  Element  Element  Element  Element  Variable  Element  Type  Element  Type  Element  Type  Element  Type  Element  Element  Element  Element  Element  Element  Element  Element  Element  Executable  Element  Element  Type  Element  Type  Element  Variable  Element  Variable  Element  Variable  Element  Variable  Element  Variable  Element  Variable  Element  Variable  Element  Element  Element  Element  int  Element  Type  Element  Type  Element  Executable  Element  Type  Element  Type  Element  Type  Element  Element  Modifier  Element  Element  Element  Element  Element  Element  Element  Variable  Element  Type  Element  Variable  Element  Annotation  Mirror  Variable  Element  Element  Class  T  Element  Kind  Type  Element  Type  Element  Type  Element  Element  Type  Element  Executable  Element  String  Type  Element  String  String  String  Type  Mirror  Type  Element  boolean  String  Type  Mirror  Type  Element  boolean  Type  Element  String  Type  Element  String  Element  Executable  Element  Executable  Element  Type  Element  Element  Package  Element  Package  Element  Type  Element  extends  extends  extends  extends  Annotation  Mirror  Element  Set  Modifier  Annotation  Mirror  Element  Annotation  Mirror  Element  Element  String  Element  Class  Element  Class  Annotated  Construct  String  Annotated  Construct  Pattern  Element  String  Element  String  extends  Annotated  Construct  Element  Element  Element  Pattern  Annotation  Mirror  String  Type  Element  String  Element  Element  Type  Mirror  Element  Element  boolean  Type  Element,Options,processor  Path  Entries  language  memory  Management  Option  emit  Line  Directives  warnings  As  Errors  deprecated  Declarations  header  Map  strip  Gwt  Incompatible  segmented  Headers  jsni  Warnings  build  Closure  included  Metadata  emit  Wrapper  Methods  extract  Unsequenced  Modifications  doc  Comments  Enabled  static  Accessor  Methods  class  Properties  processors  disallow  Inherited  Constructors  nullability  default  Nonnull  timing  Level  dump  A  S  T  lint  Argument  report  Javadoc  Warnings  translate  Bootclasspath  translate  Classfiles  annotations  Jar  global  Combined  Output  bootclasspath  emit  Kythe  Mappings  emit  Source  Headers  mappings  file  Util  package  Info  Lookup  package  Prefixes  external  Annotations  entry  Classes  source  Version  pro  Guard  Usage  File  file  Header  file  header  key  usage  Message  help  Message  xhelp  Message  usage  msg  key  help  msg  key  x  help  msg  key  xbootclasspath  timing  info  arg  known  file  suffix  pattern  obsolete  Flags  batch  processing  max  flag  Memory  Management  Option  Output  Language  Option  suffix  header  Suffix  Timing  Level  Metadata  Support  Emit  Line  Directives  Option  Combined  Output  output  Name  combined  Unit  platform  module  system  options  platform  Module  System  Options  Arg  Processor  source  Files,Output  Language  Option  suffix  header  Suffix  Combined  Output  global  Combined  Output  Name  global  Generation  Unit  global  Combined  Output  set  Global  Combined  Output  set  Log  Level  is  Verbose  load  process  Args  process  Args  File  get  Arg  Value  process  Arg  post  Process  Args  post  Process  Source  Version  has  Known  File  Suffix  add  Prefix  Option  check  Memory  Management  Option  usage  help  xhelp  version  get  Path  Argument  file  Util  doc  Comments  Enabled  set  Doc  Comments  Enabled  get  Processor  Path  Entries  get  Language  set  Output  Language  use  Reference  Counting  use  A  R  C  get  Memory  Management  Option  set  Memory  Management  Option  emit  Line  Directives  set  Emit  Line  Directives  emit  Relative  Line  Directives  set  Emit  Relative  Line  Directives  treat  Warnings  As  Errors  enable  Deprecated  Declarations  generate  Deprecated  Declarations  get  Header  Map  get  Usage  Message  get  Help  Message  get  File  Header  set  Pro  Guard  Usage  File  get  Pro  Guard  Usage  File  get  Boot  Classpath  get  Mappings  get  Package  Info  Lookup  get  Package  Prefixes  strip  Gwt  Incompatible  Methods  set  Strip  Gwt  Incompatible  Methods  generate  Segmented  Headers  set  Segmented  Headers  jsni  Warnings  set  Jsni  Warnings  build  Closure  set  Build  Closure  strip  Reflection  set  Strip  Reflection  strip  Enum  Constants  set  Strip  Enum  Constants  strip  Name  Mapping  set  Strip  Name  Mapping  set  Strip  All  Reflection  emit  Wrapper  Methods  set  Emit  Wrapper  Methods  extract  Unsequenced  Modifications  enable  Extract  Unsequenced  Modifications  get  Source  Version  set  Source  Version  static  Accessor  Methods  set  Static  Accessor  Methods  class  Properties  set  Class  Properties  get  Processors  set  Processors  disallow  Inherited  Constructors  set  Disallow  Inherited  Constructors  set  Swift  Friendly  nullability  set  Nullability  default  Nonnull  set  Default  Nonnull  lint  Argument  timing  Level  dump  A  S  T  report  Javadoc  Warnings  translate  Bootclasspath  Files  emit  Kythe  Mappings  set  Emit  Kythe  Mappings  emit  Source  Headers  set  Emit  Source  Headers  external  Annotations  add  External  Annotation  File  translate  Classfiles  set  Translate  Classfiles  entry  Classes  add  Platform  Module  System  Options  get  Platform  Module  System  Options,Element  Element  Util  String  String  String  Options  String  Level  String  String  String  Iterator  String  String  Iterator  String  String  String  Memory  Management  Option  String  boolean  String  boolean  boolean  boolean  Output  Language  Option  Memory  Management  Option  boolean  File  boolean  boolean  boolean  boolean  boolean  boolean  boolean  boolean  Source  Version  boolean  boolean  String  boolean  boolean  boolean  boolean  boolean  boolean  String  boolean  String,0,0
5,are  Parameters  Nonnull  By  Default,Element  Element  Util,boolean,,has  Annotation  get  Package  has  Annotation  to  String  get  Qualified  Name  has  Parameters  Are  Nonnull  By  Default  get  Package  Info  Lookup,Options,processor  Path  Entries  language  memory  Management  Option  emit  Line  Directives  warnings  As  Errors  deprecated  Declarations  header  Map  strip  Gwt  Incompatible  segmented  Headers  jsni  Warnings  build  Closure  included  Metadata  emit  Wrapper  Methods  extract  Unsequenced  Modifications  doc  Comments  Enabled  static  Accessor  Methods  class  Properties  processors  disallow  Inherited  Constructors  nullability  default  Nonnull  timing  Level  dump  A  S  T  lint  Argument  report  Javadoc  Warnings  translate  Bootclasspath  translate  Classfiles  annotations  Jar  global  Combined  Output  bootclasspath  emit  Kythe  Mappings  emit  Source  Headers  mappings  file  Util  package  Info  Lookup  package  Prefixes  external  Annotations  entry  Classes  source  Version  pro  Guard  Usage  File  file  Header  file  header  key  usage  Message  help  Message  xhelp  Message  usage  msg  key  help  msg  key  x  help  msg  key  xbootclasspath  timing  info  arg  known  file  suffix  pattern  obsolete  Flags  batch  processing  max  flag  Memory  Management  Option  Output  Language  Option  suffix  header  Suffix  Timing  Level  Metadata  Support  Emit  Line  Directives  Option  Combined  Output  output  Name  combined  Unit  platform  module  system  options  platform  Module  System  Options  Arg  Processor  source  Files,Output  Language  Option  suffix  header  Suffix  Combined  Output  global  Combined  Output  Name  global  Generation  Unit  global  Combined  Output  set  Global  Combined  Output  set  Log  Level  is  Verbose  load  process  Args  process  Args  File  get  Arg  Value  process  Arg  post  Process  Args  post  Process  Source  Version  has  Known  File  Suffix  add  Prefix  Option  check  Memory  Management  Option  usage  help  xhelp  version  get  Path  Argument  file  Util  doc  Comments  Enabled  set  Doc  Comments  Enabled  get  Processor  Path  Entries  get  Language  set  Output  Language  use  Reference  Counting  use  A  R  C  get  Memory  Management  Option  set  Memory  Management  Option  emit  Line  Directives  set  Emit  Line  Directives  emit  Relative  Line  Directives  set  Emit  Relative  Line  Directives  treat  Warnings  As  Errors  enable  Deprecated  Declarations  generate  Deprecated  Declarations  get  Header  Map  get  Usage  Message  get  Help  Message  get  File  Header  set  Pro  Guard  Usage  File  get  Pro  Guard  Usage  File  get  Boot  Classpath  get  Mappings  get  Package  Info  Lookup  get  Package  Prefixes  strip  Gwt  Incompatible  Methods  set  Strip  Gwt  Incompatible  Methods  generate  Segmented  Headers  set  Segmented  Headers  jsni  Warnings  set  Jsni  Warnings  build  Closure  set  Build  Closure  strip  Reflection  set  Strip  Reflection  strip  Enum  Constants  set  Strip  Enum  Constants  strip  Name  Mapping  set  Strip  Name  Mapping  set  Strip  All  Reflection  emit  Wrapper  Methods  set  Emit  Wrapper  Methods  extract  Unsequenced  Modifications  enable  Extract  Unsequenced  Modifications  get  Source  Version  set  Source  Version  static  Accessor  Methods  set  Static  Accessor  Methods  class  Properties  set  Class  Properties  get  Processors  set  Processors  disallow  Inherited  Constructors  set  Disallow  Inherited  Constructors  set  Swift  Friendly  nullability  set  Nullability  default  Nonnull  set  Default  Nonnull  lint  Argument  timing  Level  dump  A  S  T  report  Javadoc  Warnings  translate  Bootclasspath  Files  emit  Kythe  Mappings  set  Emit  Kythe  Mappings  emit  Source  Headers  set  Emit  Source  Headers  external  Annotations  add  External  Annotation  File  translate  Classfiles  set  Translate  Classfiles  entry  Classes  add  Platform  Module  System  Options  get  Platform  Module  System  Options,Element  Element  Util  String  String  String  Options  String  Level  String  String  String  Iterator  String  String  Iterator  String  String  String  Memory  Management  Option  String  boolean  String  boolean  boolean  boolean  Output  Language  Option  Memory  Management  Option  boolean  File  boolean  boolean  boolean  boolean  boolean  boolean  boolean  boolean  Source  Version  boolean  boolean  String  boolean  boolean  boolean  boolean  boolean  boolean  String  boolean  String,Element  Util,acc  bridge  acc  varargs  acc  synthetic  acc  annotation  acc  enum  acc  anonymous  acc  flag  mask  visibility  modifiers  lazy  init  nullable  pattern  nonnull  pattern  javac  Elements  element  Type  Map,Element  Util  get  Name  get  Qualified  Name  is  Named  is  Static  is  Default  is  Final  is  Public  is  Private  is  Volatile  is  Top  Level  is  Anonymous  is  Local  is  Lambda  is  Interface  is  Annotation  Type  is  Enum  is  Enum  Constant  is  Package  is  Type  Element  is  Executable  Element  is  Type  Parameter  Element  is  Annotation  Member  get  Declaring  Class  get  Superclass  get  Interfaces  is  Primitive  Constant  is  Constant  is  String  Constant  is  Global  Var  is  Instance  Var  is  Nonnull  get  Type  Qualifiers  is  Abstract  is  Native  is  Synchronized  is  Synthetic  is  Synthetic  get  Header  is  Ios  Type  get  Selector  is  Package  Info  is  Private  Inner  Type  has  Outer  Context  has  Modifier  is  Variable  is  Field  is  Parameter  is  Local  Variable  is  Method  is  Constructor  is  Instance  Method  is  Weak  Reference  is  Weak  Outer  Type  has  Weak  Property  Attribute  parse  Property  Attribute  is  Retained  With  Field  filter  Enclosed  Elements  get  Methods  get  Constructors  get  Executables  get  Declared  Fields  get  Declared  Types  params  Match  find  Method  find  Getter  Method  find  Setter  Method  find  Constructor  find  Field  as  Types  overrides  get  Package  get  Package  Name  get  Parent  Package  get  Binary  Name  get  Element  Values  With  Defaults  get  Visibility  Modifiers  from  Modifier  Set  is  Runtime  Annotation  is  Runtime  Annotation  is  Generated  Annotation  is  Generated  Annotation  has  Retention  Policy  get  Annotation  has  Annotation  has  Named  Annotation  has  Named  Annotation  has  Qualified  Named  Annotation  get  Qualified  Named  Annotation  get  All  Annotations  has  Nullable  Annotation  has  Nonnull  Annotation  has  Nullability  Annotation  get  Annotation  Value  get  Sorted  Annotation  Members  suppresses  Warning  map  Element  Type  get  Type  is  Nonnull  get  Source  File,Elements  Element  Type  Element  Element  String  Element  Element  Element  Element  Element  Variable  Element  Type  Element  Type  Element  Type  Element  Type  Element  Element  Element  Element  Element  Element  Element  Element  Element  Executable  Element  Element  Type  Element  Type  Element  Variable  Element  Variable  Element  Variable  Element  Variable  Element  Variable  Element  Variable  Element  Variable  Element  Element  Element  Element  int  Element  Type  Element  Type  Element  Executable  Element  Type  Element  Type  Element  Type  Element  Element  Modifier  Element  Element  Element  Element  Element  Element  Element  Variable  Element  Type  Element  Variable  Element  Annotation  Mirror  Variable  Element  Element  Class  T  Element  Kind  Type  Element  Type  Element  Type  Element  Element  Type  Element  Executable  Element  String  Type  Element  String  String  String  Type  Mirror  Type  Element  boolean  String  Type  Mirror  Type  Element  boolean  Type  Element  String  Type  Element  String  Element  Executable  Element  Executable  Element  Type  Element  Element  Package  Element  Package  Element  Type  Element  extends  extends  extends  extends  Annotation  Mirror  Element  Set  Modifier  Annotation  Mirror  Element  Annotation  Mirror  Element  Element  String  Element  Class  Element  Class  Annotated  Construct  String  Annotated  Construct  Pattern  Element  String  Element  String  extends  Annotated  Construct  Element  Element  Element  Pattern  Annotation  Mirror  String  Type  Element  String  Element  Element  Type  Mirror  Element  Element  boolean  Type  Element,1,1
