id,method-name,parametes-method,return-method,field-access,methods-method,contain-class-name,attributes-class,methods-class,contain-class-context,target-class-name,attributes-class,methods-class,target-class-context,tag,move-tag
21,is  Simple  Enum,Enum  Rewriter,boolean,,get  Type  Element  get  Enum  Constants  get  Executable  Element  size  get  Parameters  is  Var  Args  has  Annotation  get  Declaring  Class,Enum  Declaration,strip  Super  Interfaces  enum  Constants,Enum  Declaration  Enum  Declaration  Enum  Declaration  get  Kind  get  Super  Interface  Type  Mirrors  strip  Super  Interfaces  get  Enum  Constants  add  Enum  Constant  accept  Inner  copy,Enum  Declaration  Type  Element  extends  Enum  Constant  Declaration  Tree  Visitor  Enum  Rewriter,Enum  Rewriter,,Enum  Rewriter  end  Visit  add  Enum  Initialization  add  Simple  Non  Arc  Initialization  add  Non  Arc  Initialization  add  Arc  Initialization  visit  add  Values  Method  add  Value  Of  Method  add  Extra  Native  Decls,Compilation  Unit  Enum  Declaration  Enum  Declaration  Enum  Declaration  Enum  Declaration  Enum  Declaration  Method  Declaration  Enum  Declaration  Enum  Declaration  Enum  Declaration,1,1
22,fix  Variable  Declarations,Switch  Rewriter,void,,get  Statements  get  Statements  size  get  remove  get  Fragments  get  Initializer  get  Variable  Element  remove  add  add  size  replace  With  add,Switch  Rewriter,,Switch  Rewriter  end  Visit  end  Visit  fix  String  Value  fix  Enum  Value,Compilation  Unit  Switch  Statement  Switch  Case  Switch  Statement  Switch  Statement,Switch  Statement,expression  statements,Switch  Statement  Switch  Statement  get  Kind  get  Expression  set  Expression  get  Statements  add  Statement  accept  Inner  copy,Switch  Statement  Expression  Statement  Tree  Visitor  Switch  Rewriter,0,0
23,fix  Variable  Declarations,Switch  Rewriter,void,,get  Statements  get  Statements  size  get  remove  get  Fragments  get  Initializer  get  Variable  Element  remove  add  add  size  replace  With  add,Switch  Statement,expression  statements,Switch  Statement  Switch  Statement  get  Kind  get  Expression  set  Expression  get  Statements  add  Statement  accept  Inner  copy,Switch  Statement  Expression  Statement  Tree  Visitor  Switch  Rewriter,Switch  Rewriter,,Switch  Rewriter  end  Visit  end  Visit  fix  String  Value  fix  Enum  Value,Compilation  Unit  Switch  Statement  Switch  Case  Switch  Statement  Switch  Statement,1,1
24,rewrite  Volatile  Load,Expression,void,,get  Variable  Element  is  Volatile  is  Assigned  get  Type  Mirror  is  Primitive  get  Kind  capitalize  to  String  add  Parameters  replace  With  add  Argument,Operator  Rewriter,retained  Local  Candidate  Stack  retained  Local  Candidates  is  Synchronized  Method  rw  Count,Operator  Rewriter  end  Visit  is  String  Append  end  Visit  visit  end  Visit  visit  end  Visit  end  Visit  visit  visit  visit  visit  visit  is  Retained  Local  rewrite  Retained  Local  handle  Retained  Local  get  Assignment  Function  Name  get  Retained  With  Target  rewrite  Regular  Assignment  int  Size  Postfix  get  Infix  Function  is  Volatile  should  Rewrite  Compound  Assign  needs  Promotion  Suffix  get  Promotion  Suffix  rewrite  Compound  Assign  get  Strcat  Types  C  String  rewrite  String  Concatenation  get  String  Append  Operands  rewrite  String  Append  coalesce  String  Literals  add  String  Literal  Argument  get  Literal  String  Value  get  String  Concatenation  Type  Character,Compilation  Unit  Assignment  Tree  Node  Infix  Expression  Method  Declaration  Method  Declaration  Synchronized  Statement  Synchronized  Statement  Return  Statement  Field  Access  Super  Field  Access  Qualified  Name  Simple  Name  Variable  Declaration  Fragment  Variable  Element  Expression  Variable  Element  Expression  Expression  Assignment  Variable  Element  boolean  Assignment  Variable  Element  Assignment  Type  Mirror  Infix  Expression  Operator  Type  Mirror  Expression  Assignment  Assignment  Operator  Assignment  Assignment  List  Expression  Infix  Expression  Assignment  Assignment  List  Expression  List  Expression  String  Expression  Expression,Expression,constant  Value,Expression  Expression  get  Type  Mirror  get  Constant  Value  set  Constant  Value  copy  needs  Parentheses  For  Macro  visit  visit  visit  visit,Expression  Object  Statement  Generator  Array  Initializer  Comma  Expression  Function  Invocation  String  Literal,0,0
25,rewrite  Volatile  Load,Expression,void,,get  Variable  Element  is  Volatile  is  Assigned  get  Type  Mirror  is  Primitive  get  Kind  capitalize  to  String  add  Parameters  replace  With  add  Argument,Expression,constant  Value,Expression  Expression  get  Type  Mirror  get  Constant  Value  set  Constant  Value  copy  needs  Parentheses  For  Macro  visit  visit  visit  visit,Expression  Object  Statement  Generator  Array  Initializer  Comma  Expression  Function  Invocation  String  Literal,Operator  Rewriter,retained  Local  Candidate  Stack  retained  Local  Candidates  is  Synchronized  Method  rw  Count,Operator  Rewriter  end  Visit  is  String  Append  end  Visit  visit  end  Visit  visit  end  Visit  end  Visit  visit  visit  visit  visit  visit  is  Retained  Local  rewrite  Retained  Local  handle  Retained  Local  get  Assignment  Function  Name  get  Retained  With  Target  rewrite  Regular  Assignment  int  Size  Postfix  get  Infix  Function  is  Volatile  should  Rewrite  Compound  Assign  needs  Promotion  Suffix  get  Promotion  Suffix  rewrite  Compound  Assign  get  Strcat  Types  C  String  rewrite  String  Concatenation  get  String  Append  Operands  rewrite  String  Append  coalesce  String  Literals  add  String  Literal  Argument  get  Literal  String  Value  get  String  Concatenation  Type  Character,Compilation  Unit  Assignment  Tree  Node  Infix  Expression  Method  Declaration  Method  Declaration  Synchronized  Statement  Synchronized  Statement  Return  Statement  Field  Access  Super  Field  Access  Qualified  Name  Simple  Name  Variable  Declaration  Fragment  Variable  Element  Expression  Variable  Element  Expression  Expression  Assignment  Variable  Element  boolean  Assignment  Variable  Element  Assignment  Type  Mirror  Infix  Expression  Operator  Type  Mirror  Expression  Assignment  Assignment  Operator  Assignment  Assignment  List  Expression  Infix  Expression  Assignment  Assignment  List  Expression  List  Expression  String  Expression  Expression,1,0
26,needs  Static  Load,Tree  Node  Variable  Element,boolean,,is  Static  is  Constant  get  Enclosing  Type  Element  equals  get  Declaring  Class,Static  Var  Rewriter,,Static  Var  Rewriter  rewrite  Static  Access  visit  visit  visit  visit,Compilation  Unit  Tree  Node  Variable  Element  Expression  Field  Access  Simple  Name  Qualified  Name  Switch  Case,Tree  Node,owner  start  Position  length  line  Number  Kind,Tree  Node  Tree  Node  get  Kind  get  Parent  set  Owner  remove  replace  With  get  Start  Position  get  Length  set  Source  Range  get  Line  Number  set  Line  Number  accept  accept  Inner  copy  validate  pre  Visit  validate  Inner  set  Position  to  String  get  Source  Indent,Tree  Node  Tree  Node  Tree  Node  int  int  int  Tree  Visitor  Tree  Visitor  Tree  Node  Source  Position  Javadoc  Generator,0,0
27,needs  Static  Load,Tree  Node  Variable  Element,boolean,,is  Static  is  Constant  get  Enclosing  Type  Element  equals  get  Declaring  Class,Tree  Node,owner  start  Position  length  line  Number  Kind,Tree  Node  Tree  Node  get  Kind  get  Parent  set  Owner  remove  replace  With  get  Start  Position  get  Length  set  Source  Range  get  Line  Number  set  Line  Number  accept  accept  Inner  copy  validate  pre  Visit  validate  Inner  set  Position  to  String  get  Source  Indent,Tree  Node  Tree  Node  Tree  Node  int  int  int  Tree  Visitor  Tree  Visitor  Tree  Node  Source  Position  Javadoc  Generator,Static  Var  Rewriter,,Static  Var  Rewriter  rewrite  Static  Access  visit  visit  visit  visit,Compilation  Unit  Tree  Node  Variable  Element  Expression  Field  Access  Simple  Name  Qualified  Name  Switch  Case,1,0
28,create  Member  Fields,List  Annotation  Type  Member  Declaration  Annotation  Rewriter,Map  Executable  Element,,get  Type  Element  get  Executable  Element  get  Annotation  Property  Name  new  Field  get  Return  Type  add  Body  Declaration  put,Annotation  Rewriter,,Annotation  Rewriter  end  Visit  add  Member  Properties  add  Default  Accessors  add  Constructor  create  Annotation  Type  Method  create  Description  Method  add  Equals  Method  add  Hash  Code  Method,Compilation  Unit  Annotation  Type  Declaration  Annotation  Type  Declaration  List  Annotation  Type  Member  Declaration  Variable  Element  Annotation  Type  Declaration  List  Annotation  Type  Member  Declaration  Annotation  Type  Declaration  Variable  Element  Type  Element  Type  Element  List  Annotation  Type  Member  Declaration  Variable  Element  Annotation  Type  Declaration  Annotation  Type  Declaration,Annotation  Type  Declaration,,Annotation  Type  Declaration  Annotation  Type  Declaration  Annotation  Type  Declaration  get  Kind  accept  Inner  copy,Annotation  Type  Declaration  Type  Element  Tree  Visitor  List  Annotation  Type  Member  Declaration  Annotation  Rewriter,0,0
29,create  Member  Fields,List  Annotation  Type  Member  Declaration  Annotation  Rewriter,Map  Executable  Element,,get  Type  Element  get  Executable  Element  get  Annotation  Property  Name  new  Field  get  Return  Type  add  Body  Declaration  put,Annotation  Type  Declaration,,Annotation  Type  Declaration  Annotation  Type  Declaration  Annotation  Type  Declaration  get  Kind  accept  Inner  copy,Annotation  Type  Declaration  Type  Element  Tree  Visitor  List  Annotation  Type  Member  Declaration  Annotation  Rewriter,Annotation  Rewriter,,Annotation  Rewriter  end  Visit  add  Member  Properties  add  Default  Accessors  add  Constructor  create  Annotation  Type  Method  create  Description  Method  add  Equals  Method  add  Hash  Code  Method,Compilation  Unit  Annotation  Type  Declaration  Annotation  Type  Declaration  List  Annotation  Type  Member  Declaration  Variable  Element  Annotation  Type  Declaration  List  Annotation  Type  Member  Declaration  Annotation  Type  Declaration  Variable  Element  Type  Element  Type  Element  List  Annotation  Type  Member  Declaration  Variable  Element  Annotation  Type  Declaration  Annotation  Type  Declaration,1,1
30,replace  Loop,Statement  Statement  Enhanced  For  Rewriter,void,,get  Parent  get  Parent  replace  With  replace  With  set  Body  replace  With,Enhanced  For  Rewriter,,Enhanced  For  Rewriter  end  Visit  handle  Array  Iteration  emit  Java  Iterator  Loop  convert  To  Java  Iterator  Loop  box  Loop  Variable  make  Block,Compilation  Unit  Enhanced  For  Statement  Enhanced  For  Statement  Variable  Element  Enhanced  For  Statement  Enhanced  For  Statement  Type  Mirror  Variable  Element  Statement,Enhanced  For  Statement,parameter  expression  body,Enhanced  For  Statement  Enhanced  For  Statement  get  Kind  get  Parameter  set  Parameter  get  Expression  set  Expression  get  Body  set  Body  accept  Inner  copy,Enhanced  For  Statement  Single  Variable  Declaration  Expression  Statement  Tree  Visitor  Statement  Statement  Enhanced  For  Rewriter,0,0
31,replace  Loop,Statement  Statement  Enhanced  For  Rewriter,void,,get  Parent  get  Parent  replace  With  replace  With  set  Body  replace  With,Enhanced  For  Statement,parameter  expression  body,Enhanced  For  Statement  Enhanced  For  Statement  get  Kind  get  Parameter  set  Parameter  get  Expression  set  Expression  get  Body  set  Body  accept  Inner  copy,Enhanced  For  Statement  Single  Variable  Declaration  Expression  Statement  Tree  Visitor  Statement  Statement  Enhanced  For  Rewriter,Enhanced  For  Rewriter,,Enhanced  For  Rewriter  end  Visit  handle  Array  Iteration  emit  Java  Iterator  Loop  convert  To  Java  Iterator  Loop  box  Loop  Variable  make  Block,Compilation  Unit  Enhanced  For  Statement  Enhanced  For  Statement  Variable  Element  Enhanced  For  Statement  Enhanced  For  Statement  Type  Mirror  Variable  Element  Statement,1,1
32,get  Assigned  Variable,Lambda  Type  Element  Adder,Variable  Element,,get  Parent  get  Variable  Element  get  Left  Hand  Side  get  Variable  Element,Lambda  Type  Element  Adder,lambda  Counts,Lambda  Type  Element  Adder  get  Lambda  Unique  Name  handle  Functional  Expression  is  Weak  Outer  visit  visit  visit  visit  visit,Compilation  Unit  Functional  Expression  Functional  Expression  Functional  Expression  Lambda  Expression  Creation  Reference  Expression  Method  Reference  Type  Method  Reference  Super  Method  Reference,Functional  Expression,type  Mirror  type  Element  target  Types  descriptor  lambda  Outer  Arg  lambda  Capture  Args,Functional  Expression  Functional  Expression  get  Type  Mirror  set  Type  Mirror  get  Type  Element  set  Type  Element  get  Target  Types  add  Target  Type  get  Descriptor  set  Descriptor  get  Lambda  Outer  Arg  set  Lambda  Outer  Arg  get  Lambda  Capture  Args  copy,Functional  Expression  Type  Mirror  Type  Element  Type  Mirror  Executable  Pair  Expression  Lambda  Type  Element  Adder,0,0
33,get  Assigned  Variable,Lambda  Type  Element  Adder,Variable  Element,,get  Parent  get  Variable  Element  get  Left  Hand  Side  get  Variable  Element,Functional  Expression,type  Mirror  type  Element  target  Types  descriptor  lambda  Outer  Arg  lambda  Capture  Args,Functional  Expression  Functional  Expression  get  Type  Mirror  set  Type  Mirror  get  Type  Element  set  Type  Element  get  Target  Types  add  Target  Type  get  Descriptor  set  Descriptor  get  Lambda  Outer  Arg  set  Lambda  Outer  Arg  get  Lambda  Capture  Args  copy,Functional  Expression  Type  Mirror  Type  Element  Type  Mirror  Executable  Pair  Expression  Lambda  Type  Element  Adder,Lambda  Type  Element  Adder,lambda  Counts,Lambda  Type  Element  Adder  get  Lambda  Unique  Name  handle  Functional  Expression  is  Weak  Outer  visit  visit  visit  visit  visit,Compilation  Unit  Functional  Expression  Functional  Expression  Functional  Expression  Lambda  Expression  Creation  Reference  Expression  Method  Reference  Type  Method  Reference  Super  Method  Reference,1,1
34,get  Init  Location,Initialization  Normalizer,List  Statement,,,Initialization  Normalizer,capture  Info  Type  Normalizer  node  type  init  Statements  class  Init  Statements  const  Init  Idx,Initialization  Normalizer  end  Visit  end  Visit  end  Visit  Type  Normalizer  normalize  Members  add  Initializer  add  Field  Initializer  handle  Field  Initializer  make  Assignment  Statement  add  Capture  Assignments  is  Designated  Constructor,Compilation  Unit  Type  Declaration  Enum  Declaration  Annotation  Type  Declaration  Abstract  Type  Declaration  Initializer  Field  Declaration  Variable  Declaration  Fragment  Variable  Declaration  Fragment  Method  Declaration  Type  Element  Method  Declaration,Method  Declaration,executable  Element  name  is  Constructor  has  Declaration  is  Unavailable  parameters  body,Method  Declaration  Method  Declaration  Method  Declaration  get  Kind  get  Executable  Element  set  Executable  Element  get  Name  set  Name  is  Constructor  set  Is  Constructor  has  Declaration  set  Has  Declaration  is  Unavailable  set  Unavailable  get  Return  Type  Mirror  get  Parameter  get  Parameters  get  Body  set  Body  accept  Inner  copy  add  Parameter  add  Parameter  validate  Inner,Method  Declaration  Executable  Element  Executable  Element  Name  boolean  boolean  boolean  int  Block  Tree  Visitor  Single  Variable  Declaration  int  Single  Variable  Declaration  Initialization  Normalizer,0,0
35,get  Init  Location,Initialization  Normalizer,List  Statement,,,Method  Declaration,executable  Element  name  is  Constructor  has  Declaration  is  Unavailable  parameters  body,Method  Declaration  Method  Declaration  Method  Declaration  get  Kind  get  Executable  Element  set  Executable  Element  get  Name  set  Name  is  Constructor  set  Is  Constructor  has  Declaration  set  Has  Declaration  is  Unavailable  set  Unavailable  get  Return  Type  Mirror  get  Parameter  get  Parameters  get  Body  set  Body  accept  Inner  copy  add  Parameter  add  Parameter  validate  Inner,Method  Declaration  Executable  Element  Executable  Element  Name  boolean  boolean  boolean  int  Block  Tree  Visitor  Single  Variable  Declaration  int  Single  Variable  Declaration  Initialization  Normalizer,Initialization  Normalizer,capture  Info  Type  Normalizer  node  type  init  Statements  class  Init  Statements  const  Init  Idx,Initialization  Normalizer  end  Visit  end  Visit  end  Visit  Type  Normalizer  normalize  Members  add  Initializer  add  Field  Initializer  handle  Field  Initializer  make  Assignment  Statement  add  Capture  Assignments  is  Designated  Constructor,Compilation  Unit  Type  Declaration  Enum  Declaration  Annotation  Type  Declaration  Abstract  Type  Declaration  Initializer  Field  Declaration  Variable  Declaration  Fragment  Variable  Declaration  Fragment  Method  Declaration  Type  Element  Method  Declaration,1,1
36,is  Equality  Expression,Expression,boolean,,get  Operator,Complex  Expression  Extractor,default  max  depth  max  Depth  depths  current  Method  current  Statement  count,set  Max  Depth  reset  Max  Depth  handle  Node  pre  Visit  visit  end  Visit  end  Visit  end  Visit  end  Visit  end  Visit  end  Visit  end  Visit,int  Expression  Collection  Expression  Tree  Node  Method  Declaration  Method  Declaration  Infix  Expression  Method  Invocation  Function  Invocation  Prefix  Expression  Assignment  Parenthesized  Expression  Expression,Expression,constant  Value,Expression  Expression  get  Type  Mirror  get  Constant  Value  set  Constant  Value  copy  needs  Parentheses  For  Macro  visit  visit  visit  visit,Expression  Object  Statement  Generator  Array  Initializer  Comma  Expression  Function  Invocation  String  Literal,0,0
37,is  Equality  Expression,Expression,boolean,,get  Operator,Expression,constant  Value,Expression  Expression  get  Type  Mirror  get  Constant  Value  set  Constant  Value  copy  needs  Parentheses  For  Macro  visit  visit  visit  visit,Expression  Object  Statement  Generator  Array  Initializer  Comma  Expression  Function  Invocation  String  Literal,Complex  Expression  Extractor,default  max  depth  max  Depth  depths  current  Method  current  Statement  count,set  Max  Depth  reset  Max  Depth  handle  Node  pre  Visit  visit  end  Visit  end  Visit  end  Visit  end  Visit  end  Visit  end  Visit  end  Visit,int  Expression  Collection  Expression  Tree  Node  Method  Declaration  Method  Declaration  Infix  Expression  Method  Invocation  Function  Invocation  Prefix  Expression  Assignment  Parenthesized  Expression  Expression,1,0
38,is  Conditional,Tree  Node,boolean,,get  Operator,Unsequenced  Expression  Rewriter,current  Method  count  ordered  Accesses  current  Top  Node  has  Modification  Variable  Access  variable  expression  is  Modification,Unsequenced  Expression  Rewriter  Variable  Access  add  Variable  Access  new  Expression  visit  end  Visit  get  Unsequenced  Accesses  extract  Unsequenced  visit  And  Extract  extract  Ordered  Accesses  get  Top  Conditional  extract  Conditional  Expression  extract  Infix  Conditional  conditional  From  Sub  Branches  find  Unsequenced  get  Ancestors  is  Unsequenced  is  Within  Conditional  Branch  get  Condition  Child  end  Visit  visit  visit  visit  visit  visit  visit  visit  visit  visit  visit  visit  create  Loop  Termination  visit  visit  extract  Variable  Declaration  Fragments  extract  Expression  List  visit  visit  visit  visit,Compilation  Unit  Variable  Element  Expression  boolean  Variable  Element  Expression  boolean  Tree  Node  Method  Declaration  Method  Declaration  Statement  Expression  Statement  List  Statement  Tree  Node  List  Variable  Access  Tree  Node  Tree  Node  List  Statement  Conditional  Expression  List  Variable  Access  List  Statement  Infix  Expression  List  Variable  Access  List  Expression  Infix  Expression  Operator  Tree  Node  List  Variable  Access  Set  Variable  Access  Tree  Node  Variable  Access  Set  Tree  Node  Variable  Access  Tree  Node  Tree  Node  Tree  Node  Simple  Name  Expression  Statement  Return  Statement  Assert  Statement  Constructor  Invocation  Super  Constructor  Invocation  Enhanced  For  Statement  Variable  Declaration  Statement  If  Statement  Switch  Statement  Synchronized  Statement  Throw  Statement  Expression  While  Statement  Do  Statement  List  Variable  Declaration  Fragment  List  Statement  List  Expression  List  Statement  boolean  For  Statement  Assignment  Prefix  Expression  Postfix  Expression,Tree  Node,owner  start  Position  length  line  Number  Kind,Tree  Node  Tree  Node  get  Kind  get  Parent  set  Owner  remove  replace  With  get  Start  Position  get  Length  set  Source  Range  get  Line  Number  set  Line  Number  accept  accept  Inner  copy  validate  pre  Visit  validate  Inner  set  Position  to  String  get  Source  Indent,Tree  Node  Tree  Node  Tree  Node  int  int  int  Tree  Visitor  Tree  Visitor  Tree  Node  Source  Position  Javadoc  Generator,0,0
39,is  Conditional,Tree  Node,boolean,,get  Operator,Tree  Node,owner  start  Position  length  line  Number  Kind,Tree  Node  Tree  Node  get  Kind  get  Parent  set  Owner  remove  replace  With  get  Start  Position  get  Length  set  Source  Range  get  Line  Number  set  Line  Number  accept  accept  Inner  copy  validate  pre  Visit  validate  Inner  set  Position  to  String  get  Source  Indent,Tree  Node  Tree  Node  Tree  Node  int  int  int  Tree  Visitor  Tree  Visitor  Tree  Node  Source  Position  Javadoc  Generator,Unsequenced  Expression  Rewriter,current  Method  count  ordered  Accesses  current  Top  Node  has  Modification  Variable  Access  variable  expression  is  Modification,Unsequenced  Expression  Rewriter  Variable  Access  add  Variable  Access  new  Expression  visit  end  Visit  get  Unsequenced  Accesses  extract  Unsequenced  visit  And  Extract  extract  Ordered  Accesses  get  Top  Conditional  extract  Conditional  Expression  extract  Infix  Conditional  conditional  From  Sub  Branches  find  Unsequenced  get  Ancestors  is  Unsequenced  is  Within  Conditional  Branch  get  Condition  Child  end  Visit  visit  visit  visit  visit  visit  visit  visit  visit  visit  visit  visit  create  Loop  Termination  visit  visit  extract  Variable  Declaration  Fragments  extract  Expression  List  visit  visit  visit  visit,Compilation  Unit  Variable  Element  Expression  boolean  Variable  Element  Expression  boolean  Tree  Node  Method  Declaration  Method  Declaration  Statement  Expression  Statement  List  Statement  Tree  Node  List  Variable  Access  Tree  Node  Tree  Node  List  Statement  Conditional  Expression  List  Variable  Access  List  Statement  Infix  Expression  List  Variable  Access  List  Expression  Infix  Expression  Operator  Tree  Node  List  Variable  Access  Set  Variable  Access  Tree  Node  Variable  Access  Set  Tree  Node  Variable  Access  Tree  Node  Tree  Node  Tree  Node  Simple  Name  Expression  Statement  Return  Statement  Assert  Statement  Constructor  Invocation  Super  Constructor  Invocation  Enhanced  For  Statement  Variable  Declaration  Statement  If  Statement  Switch  Statement  Synchronized  Statement  Throw  Statement  Expression  While  Statement  Do  Statement  List  Variable  Declaration  Fragment  List  Statement  List  Expression  List  Statement  boolean  For  Statement  Assignment  Prefix  Expression  Postfix  Expression,1,0
